[
  {
    "book_edition_id": "book-edition-BATCH-2026-002-001",
    "book_work_id": "book-work-BATCH-2026-002-001",
    "edition_title": "Solving the Bottom Turtle — First Edition",
    "publisher": "SPIFFE Project",
    "imprint": null,
    "publication_date": "2020-11-17",
    "publication_country": "United States",
    "language": "lang-en",
    "translation_of": null,
    "translator": null,
    "format": "PDF",
    "ISBN-10": "0578777371",
    "ISBN-13": "9780578777375",
    "audiobook_identifier": null,
    "audiobook_narrator": null,
    "edition_statement": "First edition",
    "pagination": 194,
    "electronic_location_system": "PDF page number matching the printed page number; cover is unnumbered",
    "source_used_for_analysis": true,
    "access_basis": "Official complete first-edition PDF, unencrypted, CC BY 4.0",
    "access_date": "2026-08-15",
    "metadata_sources": [
      "https://spiffe.io/book/",
      "https://spiffe.io/pdf/Solving-the-bottom-turtle-SPIFFE-SPIRE-Book.pdf",
      "https://www.booksprints.net/book/hpe-spiffe-spire/"
    ],
    "full_text_available_for_research": true,
    "publication_permission": "CC BY 4.0; attribution required",
    "verification_status": "machine_verified_human_pending",
    "workflow_status": "content_reviewed",
    "machine_review_status": "ready_for_human_review",
    "human_review_status": "pending",
    "reviewed_by": null,
    "reviewed_at": null,
    "provenance": [
      {
        "source_url": "https://spiffe.io/book/",
        "accessed_at": "2026-08-15",
        "retrieval_method": "Official publisher, project, or author-hosted bibliographic page inspected through public web access",
        "exact_locator": "Edition-level publisher or catalogue metadata",
        "content_hash": null,
        "batch_id": "BATCH-2026-002",
        "prompt_id": "OEII-BOOK-METADATA",
        "prompt_version": "2.0",
        "notes": "CC BY 4.0"
      },
      {
        "source_url": "https://spiffe.io/pdf/Solving-the-bottom-turtle-SPIFFE-SPIRE-Book.pdf",
        "accessed_at": "2026-08-15",
        "retrieval_method": "Complete exact edition retrieved from an official public source and reviewed in full",
        "exact_locator": "PDF pages 1–194",
        "content_hash": "8353e3cf6fb8859ff34b0a43fe8146d7580dd32c9ace863c1a4758440f898fcb",
        "batch_id": "BATCH-2026-003",
        "prompt_id": "OEII-BOOK-DEEP-ANALYSIS",
        "prompt_version": "2.0",
        "notes": "Exact edition read completely"
      }
    ],
    "revision_history": [
      {
        "changed_at": "2026-08-15T00:00:00Z",
        "changed_by": "OEII analysis agent",
        "summary": "Verified pagination, date, locator system, content hash, and complete-edition access.",
        "batch_id": "BATCH-2026-003"
      }
    ]
  },
  {
    "book_edition_id": "book-edition-BATCH-2026-002-007",
    "book_work_id": "book-work-BATCH-2026-002-005",
    "edition_title": "Building Secure and Reliable Systems — O’Reilly Online Learning",
    "publisher": "O’Reilly Media, Inc.",
    "imprint": null,
    "publication_date": "2020-04-08",
    "publication_country": "United States",
    "language": "lang-en",
    "translation_of": null,
    "translator": null,
    "format": "online edition",
    "ISBN-10": "1492083119",
    "ISBN-13": "9781492083115",
    "audiobook_identifier": null,
    "audiobook_narrator": null,
    "edition_statement": "First edition",
    "pagination": 555,
    "electronic_location_system": "Official HTML chapter files with stable heading anchors; human-readable locator is chapter plus section heading",
    "source_used_for_analysis": true,
    "access_basis": "Official complete first-edition HTML hosted by Google; all 35 content files traversed",
    "access_date": "2026-08-15",
    "metadata_sources": [
      "https://www.oreilly.com/library/view/building-secure-and/9781492083115/",
      "https://google.github.io/building-secure-and-reliable-systems/"
    ],
    "full_text_available_for_research": true,
    "publication_permission": "Research access verified; metadata, canonical links, original paraphrase, and brief necessary quotation only",
    "verification_status": "machine_verified_human_pending",
    "workflow_status": "content_reviewed",
    "machine_review_status": "ready_for_human_review",
    "human_review_status": "pending",
    "reviewed_by": null,
    "reviewed_at": null,
    "provenance": [
      {
        "source_url": "https://www.oreilly.com/library/view/building-secure-and/9781492083115/",
        "accessed_at": "2026-08-15",
        "retrieval_method": "Official publisher, project, or author-hosted bibliographic page inspected through public web access",
        "exact_locator": "Edition-level publisher or catalogue metadata",
        "content_hash": null,
        "batch_id": "BATCH-2026-002",
        "prompt_id": "OEII-BOOK-METADATA",
        "prompt_version": "2.0",
        "notes": "Complete official text accessible for research; no open republication license identified"
      },
      {
        "source_url": "https://google.github.io/building-secure-and-reliable-systems/",
        "accessed_at": "2026-08-15",
        "retrieval_method": "Complete exact edition retrieved from an official public source and reviewed in full",
        "exact_locator": "35 official HTML files with chapter/section anchors",
        "content_hash": "6bf5050c08be0bced81767ac14bd9b3303e34b3efb667806b3c9e9d6b0ed8cf1",
        "batch_id": "BATCH-2026-003",
        "prompt_id": "OEII-BOOK-DEEP-ANALYSIS",
        "prompt_version": "2.0",
        "notes": "Manifest hash ae702b4e64364217f179317b4a46de6a5e7c51045a79efa67522245d76667e16; exact edition read completely"
      }
    ],
    "revision_history": [
      {
        "changed_at": "2026-08-15T00:00:00Z",
        "changed_by": "OEII analysis agent",
        "summary": "Verified date, stable locator system, complete content manifest, and normalized text hash.",
        "batch_id": "BATCH-2026-003"
      }
    ]
  }
]
